{
  "id": "default",
  "version": 1,
  "seed": 20261021,
  "generator": "oasis-v1",
  "sectors": [
    {
      "id": "s_plaza",
      "name": "Сектор Плаза",
      "flags": {
        "pvp": false,
        "magic": false,
        "tech": true,
        "teleport": true,
        "comms": true
      },
      "spawn": {
        "x": -5,
        "y": 0,
        "z": 10
      }
    }
  ],
  "zones": [
    {
      "id": "z_plaza",
      "sectorId": "s_plaza",
      "name": "Плаза",
      "kind": "plaza",
      "bounds": {
        "x": 0,
        "z": 0,
        "w": 64,
        "d": 64
      },
      "groundColor": 7305868,
      "props": [
        {
          "id": "z_plaza:col0",
          "type": "pillar",
          "x": 26.236606170029994,
          "y": 2.721139893226791,
          "z": 0.42201502194107854,
          "sx": 0.45,
          "sy": 2.721139893226791,
          "sz": 0.45,
          "rot": 0.016083582967985424,
          "color": 9081766
        },
        {
          "id": "z_plaza:col1",
          "type": "pillar",
          "x": 23.46051173226612,
          "y": 2.1950385089148767,
          "z": 11.753382034980554,
          "sx": 0.45,
          "sy": 2.1950385089148767,
          "sz": 0.45,
          "rot": 0.46443589697272264,
          "color": 7305868
        },
        {
          "id": "z_plaza:col2",
          "type": "pillar",
          "x": 17.019386701124507,
          "y": 1.909549218020402,
          "z": 19.97193221292287,
          "sx": 0.45,
          "sy": 1.909549218020402,
          "sz": 0.45,
          "rot": 0.8650465629930929,
          "color": 9081766
        },
        {
          "id": "z_plaza:col3",
          "type": "pillar",
          "x": 7.249384118438309,
          "y": 2.9416826557717286,
          "z": 25.21872379608719,
          "sx": 0.45,
          "sy": 2.9416826557717286,
          "sz": 0.45,
          "rot": 1.290883092770541,
          "color": 7305868
        },
        {
          "id": "z_plaza:col4",
          "type": "pillar",
          "x": -2.8416112198759587,
          "y": 2.1644136465038173,
          "z": 26.085682771878428,
          "sx": 0.45,
          "sy": 2.1644136465038173,
          "sz": 0.45,
          "rot": 1.6793022282642955,
          "color": 9081766
        },
        {
          "id": "z_plaza:col5",
          "type": "pillar",
          "x": -14.086110341833573,
          "y": 2.918342493358068,
          "z": 22.138633549469333,
          "sx": 0.45,
          "sy": 2.918342493358068,
          "sz": 0.45,
          "rot": 2.1374576717571694,
          "color": 9081766
        },
        {
          "id": "z_plaza:col6",
          "type": "pillar",
          "x": -21.850638234338284,
          "y": 1.7596000918420032,
          "z": 14.528840585266046,
          "sx": 0.45,
          "sy": 1.7596000918420032,
          "sz": 0.45,
          "rot": 2.554802978345569,
          "color": 9081766
        },
        {
          "id": "z_plaza:col7",
          "type": "pillar",
          "x": -25.878567612295914,
          "y": 2.102032041992061,
          "z": 4.340200264484216,
          "sx": 0.45,
          "sy": 2.102032041992061,
          "sz": 0.45,
          "rot": 2.9754250407577225,
          "color": 5595258
        },
        {
          "id": "z_plaza:col8",
          "type": "pillar",
          "x": -25.6065999155547,
          "y": 1.9256300888373516,
          "z": -5.730588169177218,
          "sx": 0.45,
          "sy": 1.9256300888373516,
          "sz": 0.45,
          "rot": 3.3617583445017583,
          "color": 11121346
        },
        {
          "id": "z_plaza:col9",
          "type": "pillar",
          "x": -20.63731272896978,
          "y": 2.4669140309561044,
          "z": -16.20613844586988,
          "sx": 0.45,
          "sy": 2.4669140309561044,
          "sz": 0.45,
          "rot": 3.8072954002480075,
          "color": 9081766
        },
        {
          "id": "z_plaza:col10",
          "type": "pillar",
          "x": -12.37239765596325,
          "y": 2.5082265861565247,
          "z": -23.1400383803207,
          "sx": 0.45,
          "sy": 2.5082265861565247,
          "sz": 0.45,
          "rot": 4.221387765408188,
          "color": 9081766
        },
        {
          "id": "z_plaza:col11",
          "type": "pillar",
          "x": -2.466730544407263,
          "y": 1.8969750186079182,
          "z": -26.12379835363319,
          "sx": 0.45,
          "sy": 1.8969750186079182,
          "sz": 0.45,
          "rot": 4.618243468063641,
          "color": 9081766
        },
        {
          "id": "z_plaza:col12",
          "type": "pillar",
          "x": 8.20639454640784,
          "y": 2.0317583671421744,
          "z": -24.92373745144752,
          "sx": 0.45,
          "sy": 2.0317583671421744,
          "sz": 0.45,
          "rot": 5.030469237986307,
          "color": 5595258
        },
        {
          "id": "z_plaza:col13",
          "type": "pillar",
          "x": 18.380331192601904,
          "y": 2.7931163395987824,
          "z": -18.727013249588556,
          "sx": 0.45,
          "sy": 2.7931163395987824,
          "sz": 0.45,
          "rot": 5.488444735266152,
          "color": 5595258
        },
        {
          "id": "z_plaza:col14",
          "type": "pillar",
          "x": 24.10183961629919,
          "y": 2.0730001888005063,
          "z": -10.37491817366242,
          "sx": 0.45,
          "sy": 2.0730001888005063,
          "sz": 0.45,
          "rot": 5.8766976848495585,
          "color": 11121346
        },
        {
          "id": "z_plaza:monument",
          "type": "box",
          "x": 0,
          "y": 1.4,
          "z": 0,
          "sx": 1.6,
          "sy": 1.4,
          "sz": 1.6,
          "rot": 0,
          "color": 9081766
        },
        {
          "id": "z_plaza:bench0",
          "type": "box",
          "x": 5.965071395452265,
          "y": 0.25,
          "z": 18.224243287740528,
          "sx": 1.1,
          "sy": 0.25,
          "sz": 0.45,
          "rot": 1.2544718575367697,
          "color": 5595258
        },
        {
          "id": "z_plaza:bench1",
          "type": "box",
          "x": 15.038627359015248,
          "y": 0.25,
          "z": 6.1589700273035275,
          "sx": 1.1,
          "sy": 0.25,
          "sz": 0.45,
          "rot": 0.3887062457582232,
          "color": 5595258
        },
        {
          "id": "z_plaza:bench2",
          "type": "box",
          "x": 17.759107169529667,
          "y": 0.25,
          "z": 9.034077738905705,
          "sx": 1.1,
          "sy": 0.25,
          "sz": 0.45,
          "rot": 0.4705842521458399,
          "color": 5595258
        },
        {
          "id": "z_plaza:bench3",
          "type": "box",
          "x": 17.429559769991446,
          "y": 0.25,
          "z": 11.306882853469599,
          "sx": 1.1,
          "sy": 0.25,
          "sz": 0.45,
          "rot": 0.5754740155112159,
          "color": 5595258
        },
        {
          "id": "z_plaza:bench4",
          "type": "box",
          "x": -17.331875310352007,
          "y": 0.25,
          "z": -10.693039299607952,
          "sx": 1.1,
          "sy": 0.25,
          "sz": 0.45,
          "rot": 3.6943880522170147,
          "color": 5595258
        },
        {
          "id": "z_plaza:bench5",
          "type": "box",
          "x": -6.820963927571857,
          "y": 0.25,
          "z": -17.245626175389805,
          "sx": 1.1,
          "sy": 0.25,
          "sz": 0.45,
          "rot": 4.335751938980129,
          "color": 5595258
        },
        {
          "id": "z_plaza:bench6",
          "type": "box",
          "x": 5.244690190068193,
          "y": 0.25,
          "z": -17.362860301241657,
          "sx": 1.1,
          "sy": 0.25,
          "sz": 0.45,
          "rot": 5.005738019846802,
          "color": 5595258
        },
        {
          "id": "z_plaza:bench7",
          "type": "box",
          "x": 12.361287320384132,
          "y": 0.25,
          "z": 1.1389813840445338,
          "sx": 1.1,
          "sy": 0.25,
          "sz": 0.45,
          "rot": 0.09188156309876414,
          "color": 5595258
        },
        {
          "id": "z_plaza:bench8",
          "type": "box",
          "x": -0.09234096634575413,
          "y": 0.25,
          "z": 17.554497477591667,
          "sx": 1.1,
          "sy": 0.25,
          "sz": 0.45,
          "rot": 1.5760565237775006,
          "color": 5595258
        },
        {
          "id": "z_plaza:bench9",
          "type": "box",
          "x": -20.82912513921788,
          "y": 0.25,
          "z": -11.883091234943093,
          "sx": 1.1,
          "sy": 0.25,
          "sz": 0.45,
          "rot": 3.660041216824884,
          "color": 5595258
        },
        {
          "id": "z_plaza:bench10",
          "type": "box",
          "x": 12.141284879275933,
          "y": 0.25,
          "z": -2.8633353419941394,
          "sx": 1.1,
          "sy": 0.25,
          "sz": 0.45,
          "rot": 6.051582550783722,
          "color": 5595258
        },
        {
          "id": "z_plaza:bench11",
          "type": "box",
          "x": -9.261170242094648,
          "y": 0.25,
          "z": -11.95903212408992,
          "sx": 1.1,
          "sy": 0.25,
          "sz": 0.45,
          "rot": 4.053448868746973,
          "color": 5595258
        },
        {
          "id": "z_plaza:bench12",
          "type": "box",
          "x": 7.606602444309742,
          "y": 0.25,
          "z": 18.4490546396313,
          "sx": 1.1,
          "sy": 0.25,
          "sz": 0.45,
          "rot": 1.1797290263464113,
          "color": 5595258
        },
        {
          "id": "z_plaza:bench13",
          "type": "box",
          "x": -5.060084970438884,
          "y": 0.25,
          "z": -18.8092935438546,
          "sx": 1.1,
          "sy": 0.25,
          "sz": 0.45,
          "rot": 4.449590345903857,